label,review,length,positive,negative,anger,disgust,fear,sadness,surprise,good,happy
0,谁有创伤，赶快接吻吧三重门告诉我们，所谓接吻就是四片嘴唇相碰，而人大多时间都在接吻——自吻。是哦~ 怎么办~ 还好我工作中经常碰到~ 我3年少活多少年!!!应该是经过研究的。每一次接吻，会消耗体内至少12个卡路里。经常接吻的人平均寿命较一般人要长5年。接吻是治疗打嗝不止的最有效方法。接吻时12组唇部肌肉& 17组舌头肌肉会程紧张状态促进血液循环有助预防皱纹令皮肤更光滑有美容效果。激吻时因受刺激所分泌的内啡 泰荷尔蒙相当于一片止痛药的效果让人暂时忘掉忧伤。,141,3,4,0,0,0,4,0,3,0
0,邀歌呀终于和大师合影了！,8,1,0,0,0,0,0,0,1,0
3,我承认我生活得很不舒适...【当前全国各大城市舒适生活的月薪标准】童鞋们快来看看你的生活是否舒适?,31,4,0,0,0,0,0,0,4,0
0,阿米豆腐，善哉善哉~ …………昨天在西单偶遇唐僧师徒四人在化缘........,21,0,0,0,0,0,0,0,0,0
3,细节帝。。。。,6,0,0,0,0,0,0,0,0,0
0,谢谢小自~ ~ ~ 照片9.周迅采访完往回走时碰上王中磊，王展示给她看他刚在现场拍得的什么拍品，那个拍到胳膊是的，呵呵,41,1,0,0,0,0,0,0,0,1
0,我最爱钞票。。。同~ 我也是酱紫的~ 明天出发赚钱！太给力了，这图简直就是为我而生,30,1,0,0,0,0,0,0,0,1
0,有趣收到了这一条转出来，送给意在不言中，你懂的！“没错。若我不接受你的谩骂，那你就是在骂自己。”,36,1,1,0,1,0,0,0,1,0
3,犀利左边系王祖蓝亲妹。右边系王祖蓝扮嘅 handelababy .我接受唔到咯。,21,1,0,0,0,0,0,0,1,0
3,12星座最容易发胖位置& 发胖指数~ ~ 【12星座最容易发胖位置& 发胖指数】------白羊—小腹50%；金牛—腰腹80%；双子—大腿60%；巨蟹—脂肪肚90%；狮子—臀部30%；处女—不详10%；天秤—胳膊50%；天蝎—全身90%；射手—腹部50%；魔羯 —小腿40%；水瓶—腰腹80%；双鱼—全身90%。,94,0,1,0,1,0,0,0,0,0
0,精闢 !!!哈哈..灰常跟风的交通警示牌。,13,1,0,0,0,0,0,0,0,1
0,一个字：“俗”。。。。@ 风从那?,16,0,0,0,0,0,0,0,0,0
1,擦TMD 还好意思拍照留影受不了，TMD 。。真的开始骂了，有什么资格称为警察？《?,26,0,2,0,2,0,0,0,0,0
0,好寒，好雷，好恐怖检查有没有余粮。據 說 ?,15,0,1,0,0,1,0,0,0,0
3,maybe 人在江湖身不由己呢！有道理~ ~ ~ ~ “一个人，如果没有空，那是因为他不想有空，一个人，如果走不开，那是因为他不想走开，一个人，对你借口太多，那是因为不想在乎。”,57,0,2,0,1,0,1,0,0,0
3,我心裡 深深的準 備 好了但人到不了!!!唉!!!我只能祝你生意興 隆!!!!我的前男友!!!準 備 好了嗎 ！Mischief 開 幕之夜！,54,0,1,0,1,0,0,0,0,0
2,姐，俺比你强，俺到一个地方，只要介绍过的人名都能记住，字都不会写错，嘿嘿新学校人太多了，转过个身就把人姓什么叫什么给忘了,43,0,0,0,0,0,0,0,0,0
0,謝 謝 你們 小米，你要知道，我们永远爱你、支持你！！！我只能說 我愛 你了對 說 ：路小米！！你是我心中的素顏 女神！！！素顏 大正妹！！！,57,1,0,0,0,0,0,0,1,0
0,回复登电脑玩喽回复哎……手机可以收藏吗？那就只有等我们中国人设计了: 能唱中文的就好了: 这个好玩，不过歌词的写英文在这里你可以选择中意的小人来哼唱你所写的歌。无论写什么他都能唱出来！哈哈！还有动物伴唱来试试吧！操作方法：,77,3,2,0,2,0,0,0,1,2
0,。玩儿过植物大战僵尸的你懂的，the zombie is coming 。。。,22,0,0,0,0,0,0,0,0,0
1,气的我想杀人!!!MD !!!以后我再买惠普的东西我就是猪!!!!!,28,0,0,0,0,0,0,0,0,0
0,写大牌就是有感觉！！Dior homme,10,0,0,0,0,0,0,0,0,0
2,爆寒……哈哈，唱得不错嘛！红雷哥，你这是要跟菲姐pk 吗：）我勒个去这货不是孙红雷这货不是孙红雷，，我哭了,35,2,2,0,2,0,0,0,1,1
3,得不到你所以只好囚禁你，留不住你的心至少留住你的人。。。法海对白素贞永恒的爱~ 好感动,29,1,1,0,0,1,0,0,1,0
0,【节目录音】本周《DJ 周记》值班DJ 小夫坐班直播室与你music fall in love ！本周开场金曲：陈奕迅、露云娜-《讲男讲女》播出时间：逢周六下午5:50FM86 华师广播台,53,0,0,0,0,0,0,0,0,0
2,哈哈~ 痴线佬啊！好残忍啊.......竟然这样折磨洗衣机...。用洗衣机洗砖头的后果，我哭了洗衣机做鬼也不会放过你……,35,1,3,0,3,0,0,0,0,1
1,"该项目建设单位是都江堰市国有资产投资经营公司和四川省三秦房地产开发有限责任公司，尽管是国企背景和隶属灾后重建项目......天怒人怨！都江堰市政府是黑社会吗！！！！！！！！！！！！！！！！！！！！！！！！！！！！！！！！！！！！！！！！！！！！！！！！！据众多工友回忆，警察到达现场后并未有效控制局面。相反，令人不解地对讨薪的工友进行了殴打。由于事发时间在下午下班后不久，现场很快便被愤怒工友围堵，3名警察翻墙逃出，而行凶者此时则躲在指挥部办公室。《都江堰民工讨薪被砍死抢尸者"" 坐满12辆公交"" 》",160,2,3,0,1,1,1,0,2,0
0,这是我最喜欢的一版啦给大家看看《贫尼和法官大人的瞬间火花》的封面~,22,2,0,0,0,0,0,0,1,1
2,身体极大不舒服，又不想请假，还有很多电话没打呢,15,1,0,0,0,0,0,0,0,1
0,索要演讲实录=)王煜全演讲立场鲜明，言语直接，估计底下观众们都听得很爽，分析了产业链及格局，讨论了api ，召集了开发者（也帮投资人找项目？），过程中批驳了运营商、某u 、某场的某些产品，一会去微博内容中搜索下，看看微博博友们有没有根据演讲内容展开讨论无线互联应用开发者创业孵化论坛Frost & Sullivan 首席顾问王煜全发表题为《无线互联的布道与孵化》的演讲,102,2,1,0,1,0,0,0,2,0
0,中秋节快乐，月饼最大君姐你这个笑容太酥了我都成脆皮的了,18,3,0,0,0,0,0,0,0,3
0,不管聊啥，铁三角是我最推荐的人选！）,13,1,0,0,0,0,0,0,1,0
1,在玩繁体中文版的红楼梦游戏，为了成全宝黛，处心积虑把袭人薛宝钗赶走，连史湘云都快逼死了。结果，Kao ！贾宝玉跟蒋玉菡 私奔了！！！！！！,43,2,2,0,2,0,0,0,1,1
0,回复不觉得这就是新时代人们所需要的精神力量吗？淳朴谦虚更富有进取之心。当之无愧乎！你过誉了，文心跟大家一样用心感悟人生而已。多谢，真热闹啊，O 文心是微博诗新一代女性诗人的代表人物。她才情横溢，诗词散文俱佳。其作品多以抒情诗为主，但写法多变，在新诗的探索与发展上作出了很多有意义的实践。善于把古典诗词的语言美、意蕴美和现代诗歌的结构美有机结合，可谓“新实验诗”的先锋人物。,114,14,1,0,1,0,0,0,13,1
1,要是坐在上面。。。那屁屁～～如果你住在一个连晾衣架都没有的小公寓里，里面却配备了暖气片，设计师Eunggyu Lee 的这把椅子就能帮助你晾干衣服。把衣服悬挂在椅子靠背的横条上，再将椅子搭在暖气片上，就能吹干衣服了。暖气还可以顺着椅子顶部的入口进去，在管道里面流通，能加快晾干。,89,1,0,0,0,0,0,0,1,0
0,我都看懂了...怎么办...【纯情指数测试】看懂0幅的超级纯情，看懂1-5幅的还需学习，看懂6幅的经验就相当滴丰富了！！,45,4,0,0,0,0,0,0,4,0
1,回复基本上只剩下感冒症状了嗯嗯，i have sexy voice !片头还好吧，你身体怎么样了本来想好转一点看看big bang theory ，结果那片头晃得我快吐了……病人也需要娱乐的吗！！！！,60,1,0,0,0,0,0,0,0,1
0,搞笑的学生作文。很有耐心的老师。,11,1,0,0,0,0,0,0,1,0
0,就下面那个咬他！我艹 ，刚哪个孙子把我推下去的？有人证没？,22,0,0,0,0,0,0,0,0,0
1,同意分享图片高跟鞋是女人必备的单品，它们既能提升你的气场，又能增加自己的自信，同意吗,27,1,0,0,0,0,0,0,1,0
0,""" 爱是最美丽的法律"" !!!同志你好北京街拍第96个微笑.这位藏族的哥哥为了给我们写下这句话!思考了有5分钟!上面的藏文你看懂了吗?这是此次街拍我最喜欢的一句话"" 爱是最美丽的法律"" 意义深远..@ 亮马SB",76,5,0,0,0,0,0,0,4,1
0,阳光酒窝SD 小正太十分有优型男架势）供你们噩梦。俺睡去鸟,20,1,1,0,0,1,0,0,0,1
0,【史上最搞怪的奶奶】上次发了一条关于“潮到爆的时尚帅爷爷[,19,1,0,0,0,0,0,0,1,0
1,苏子苒 这种一看就是言情小说女配耽美小说【炮灰】女配【炮灰】受的名字是要怎样！摔诗洛蔓……右边的右边，敢情我们是亲戚啊漠洛苒 ，请问我是五行缺水缺木么……还好我本名里有水有木==木唯凉，冷死人1苏2陌3浅4诗5漠6染7安8夏9木0伊。二.月份：1颜2唯3洛4雨5潇6子7小8简9晗10宇11景12悠。三.日期：1苒 2若3希4韵5雅6朵7涵8蔓9曦10璇11暄12默13言14柒15嫣16紫17荨 18帆19末20凉21落22尘23语24轩25歌26熙27夕28影29莫30然31语。我染悠歌，还不赖,186,2,2,0,0,0,2,0,2,0
0,期待！期待两张专辑！看到重点了，除了十一月的《波点潮》之外，十二月要发英法双语专辑。,24,0,1,0,0,1,0,0,0,0
1,WHO ？哪个菲姐啊？哇塞~ ~ 糊里糊涂找到菲姐的围脖！！赶紧加起来！！,24,2,1,0,1,0,0,0,1,1
0,今天是这位领导的诞辰啊，这娃怎么看着很像某领导人呵呵，没意见。没什么意见，一样吧新浪微博升级，不知同志们有没有什么意见？,36,2,0,0,0,0,0,0,0,2
0,小样，找打是不是？至今见过的最牛X 的猫咪了，谁有见过比它还牛的，赶紧投稿来与大家分享。。。,37,0,0,0,0,0,0,0,0,0
0,最近在空间了一篇关于川菜做法的日志，没想到印发了大家空前的热情，还有好多不是好友也转了，看来好吃狗儿还是挺多的哈，再把链接发上来，喜欢川菜的朋友可以学习。我反正是做好大显身手的准备了！,57,7,1,0,1,0,0,0,7,0
0,任岁月风干，生活像一把无情刻刀，改变了我们的梦想。傻傻等待2年却没好结果，何必，新生活吧。抛开一切，生活并不会抛弃你！,40,0,2,0,2,0,0,0,0,0
0,我觉得挺好的啊哪有雷人啊,10,0,0,0,0,0,0,0,0,0
2,今年总是出事，烦死了。多事之秋！除了祈祷，我们还能做什么。。这些年天灾啊%多少，人祸啊%多少？【最新消息】青海地震已发现4名死者，另有多人被埋温总他老人家又该忙了，是又要捐款了嘛。14日早晨7时49分，青海省玉树藏族自治州玉树县发生7.1级地震，震源深度33公里，属于浅源地震，震中位于县城附近。,93,0,3,0,2,1,0,0,0,0
3,感动的内牛满面晚上公猪总为母猪放哨，生怕主人将母猪宰了，日子飞逝，母猪变胖。它听见主人商量要把母猪杀了卖掉。自那天公猪性情大变，主人送来食物它抢着吃，吃完就睡并要母猪守夜。母猪觉得他不在乎她，很失望。主人发现母猪没剩几斤了，而公猪油光发亮，终于屠户把公猪拖走，公猪笑着对母猪说“以后少吃点”!,95,0,2,0,0,1,1,0,0,0
2,这个应该给那个叫什么秋石的文章放一块....新华社不是毛泽东政权的吗这是《新华日报》1945年9月27日社论。1949年那个旧政权不就被推翻了吗？一个民主国家，主权应该在人民手中，这是天经地义的事；如果一个号称民主的国家，而主权不在人民手中，这决不是正轨，只能算是变态，就不是民主国家...不结束党治，不实行人民普选，如何能实现民主?把人民的权利交给人民!（《新华日报》1945年9月27日社论）,119,8,3,0,3,0,0,0,8,0
0,当年是哪个家伙当面忽悠老头说，招风耳就是招福？老实交待！估计熙熙的招风耳（某人貌似是这么形容的吧）就是被他外公给天天拧成的~ 小盆友真乖。。。某外公搞小动作。。。。揪耳朵的真相~ 发布帖传送门,60,1,1,0,1,0,0,0,1,0
1,"哇，看来益力多的市场很庞大啊···我的最爱,我的最爱..哈哈,新版的益力多,唔知边有得买益力多light 版....",40,1,0,0,0,0,0,0,0,1
0,未雨绸缪嘛~ 哈哈~ 现在开始约，早了点吧2011年11月11日是周五，上午11点11分，微博里的光棍们聚会吧！,38,2,1,0,1,0,0,0,1,1
2,无意中看见的，真是没有语言了……郑州城市不错，有中超球队，赛前还紧急翻修了，为什么是这个样子呢？平了也行啊~ 关键是人家赢了,43,1,1,0,0,1,0,0,1,0
0,么么凤姐，你的言语也太招摇了吧，很多事情不是“去死”就能解决的，有空来我们昆明坐坐吧，哇咔咔，让你上上我的节目！各位注意哇！凤姐要去自杀了。。。我和孙建业没有任何关系，如果再有媒体出孙建业炒作我的假新闻。这个媒体就立即倒闭。所有员工全部去自杀，,86,1,3,0,3,0,0,0,0,1
0,其实我也想笑去使玻璃心什么？我想笑……如果曾经千军万马的黑都没让你玻璃心的话，那么这张，绝对能让你玻璃心。。。小样儿~ ~ ~ ~,46,1,0,0,0,0,0,0,1,0
3,六月末，又到了半年总结时,9,0,0,0,0,0,0,0,0,0
0,梦幻气质。【附上奥黛丽赫本的可爱瞬间】,11,2,0,0,0,0,0,0,2,0
0,回复嗯那我开辟她专栏啦哈哈哈哈梁咏琪的很多歌都可以啊最近GIGI 关注人气很高用她的歌没错的一大堆人挺你新的一年来临了，祝福大家节日愉快，在你欢度节日的同时，不妨关注，它一定给你带来惊喜，相信爱，相信OUO 中国，今天的话题是，介绍点经典好听的歌曲，看谁列举多！加油喔，大奖还有呢,89,8,0,0,0,0,0,0,6,2
3,"国际！国际！国际！国际！国际！慈善！慈善！名人！好吧，我为旁边那两朵小康乃馨转~ ~ 那我为哈根达斯转为名人,还是国际的慈善的转.刚刚在人民大会堂领完国际慈善名人奖，在赶去下个通告的间隙，黄先生请大家吃哈根达斯…",67,7,0,0,0,0,0,0,7,0
2,回复奴隶式教化都没有把你们改造好啊，失败【开篇】李公明《大学生的恐惧与冷漠是怎样炼成的》起主要作用的倒不是冷漠，而是恐惧，有关眼下利益（各种奖学金等等）与未来（就业等等）的恐惧。这时候长期以来的奴化教育自然会显示其功能。,66,4,7,0,4,3,0,0,3,1
3,繁衍生息的栖息地被人类破坏，等待这些动物的只有死亡，而且这种残留下来的污染还会持续几百年，这一切都让大自然在痛苦中承受消磨！人类什么时候才能停止这种伤害大自然的行为，殊不知大自然的忍耐是有限度的！,55,1,4,0,2,0,2,0,1,0
0,"找个人12月15日陪我看流星雨去,哇哈哈【2010下半年流星雨】8月12日，英仙座流星雨极大；8月20日，天鹅座流星雨极大；10月8日，天龙座流星雨极大；10月21日，猎户座流星雨极大；11月8日，南北金牛座流星雨极大；11月18日凌晨1时至天亮前，狮子座流星雨极大；12月15日凌晨，双子座流星雨极大；12月22日，小熊座流星雨极大。一定到时欣赏哦！",104,3,0,0,0,0,0,0,2,1
0,未能在中原地产实现的培训师目标，现在有机会在碧桂园实现，需要时间！~,20,0,0,0,0,0,0,0,0,0
3,边个系北风？突然发现，北风应该也挺想黄伟文的: 摄影师平深！！！哈哈，你们哥俩终于相认了！啊！謝 謝 ！,36,1,0,0,0,0,0,0,0,1
0,哈哈~ 真神奇~ 去看了哈哈，罗祥的魅力是有多大啊，是不是，有没有有點 神奇阿祥的魅力無 限啊...。太让我大吃一惊了，一个和尚居然在新浪微博里关注了罗志祥，哈哈，太Hi 了,59,6,0,0,0,0,0,3,0,3
1,高跟鞋我快疯了！high heels 分享图片,12,0,0,0,0,0,0,0,0,0
0,嘟……嘟臀！有图有真相！猜猜他是谁？大家踊跃便捷加内容，我们这期话题持续到这周日，下周一会公布第二个话题，并公布获奖者信息！大家一起泡世界杯！一起快乐足球！原来你的真的比我们白。哇……,61,4,0,0,0,0,0,1,2,1
3,胸腰臀三大最吃香的部位等看的纯熟了以后，一看女人身材就知道是啥星座了哪啊？嗯，以后知道看哪了摩羯 —膝盖有啥用啊？,42,2,0,0,0,0,0,0,2,0
1,还行...只能看第六行和第六行以上，那你的显示器还是别用了；到七八行的，基本是属于较差但是还能使用的；能看到第九行和第十行就算比较好了；我能到看十，但看不到十一你的显示器能看到第几行的字？,64,0,0,0,0,0,0,0,0,0
0,宝宝！你就嫌弃我们吧！继续嫌弃！哈哈~ ~ 某灯牌。宝宝是说你们二。,24,1,0,0,0,0,0,0,0,1
3,请允许我再乌鸦嘴下，今夜阿根廷将会被墨西哥淘汰1德国战车再次让不列颠骑士蒙羞！可怕的日耳曼民族，在此用其优秀的团队配合能力向世界演绎了一场伟大的比赛！,44,3,1,0,0,1,0,0,3,0
0,太赞了。。大图太大缩了一下=-=请有序前来受死传说中的七面巨型光影立方体,22,0,0,0,0,0,0,0,0,0
1,其實 ..我真的真的好想去旅行~ 好多美麗 的地方都吸引著我你們 最想去哪裡 旅行?我好想去馬 爾 代夫!!!> <,45,0,0,0,0,0,0,0,0,0
1,我的动力，肥肥成的压力，哈哈...发完这条围脖，我就整一败家女形象了女人的动力，男人的压力。。。,31,1,0,0,0,0,0,0,0,1
0,想到嘟嘟小时候的，霍特思像！那无辜的小眼神好可爱啊！！,18,1,1,0,0,0,1,0,1,0
1,好美的图最后一次的拥有最难舍。（BY 佚名）早安，各位。,19,0,0,0,0,0,0,0,0,0
0,“返回顶部”在最右侧也随时浮动！相当的人性化。微博。刚发现新消息提示改为浮动的了，很好,29,0,1,0,0,0,1,0,0,0
1,为什么事故发生这么久还没个说法？因为漏油而寻求赔偿的大连渔民没有从中石油这家富得流油的公司那里得到丝毫安慰。中石油在大连漏油事件中的傲慢态度，显示该企业既缺乏社会责任感，也缺乏民事主体平等的法律意识，更缺乏市场经济中的规则意识……漠视任何规则，漠视任何普通人的利益，直至最终尾大不掉。（via FT 中文网叶檀）,86,4,8,0,8,0,0,1,2,1
2,愿人类和平共处到永久！【“光之塔”纪念911】9月11日晚上八点至十一点，两座光线组成的双塔如同两个点燃后的蜡烛，光线可辐射至远方，以此凭吊那些在911事件中去世的人们。,51,0,2,0,0,0,2,0,0,0
0,宝贝太可爱了···笑死我了超级搞笑，世界上最胆小的熊!把我笑趴下了！！！,29,2,1,0,1,0,0,0,2,0
0,: : : : 。的超高像素名单图，要找人的可以“查看大图”细看。集微博之力，转给需要的人。,34,0,0,0,0,0,0,0,0,0
3,小二，今天很累吧？心疼你。二哥MM 演唱會 內 地第一場 的場 景，細 數 今天的南京是第幾 場 ？！,41,1,1,0,0,0,1,0,0,1
0,吖    牡 乃 牡 膥 ???,20,0,0,0,0,0,0,0,0,0
0,老洋气的live ！《奖献唱《》,10,0,0,0,0,0,0,0,0,0
3,实拍英男子机场“坐”无形椅读报被围观。我觉得秘密应该在他的右腿里边吧。。,24,0,0,0,0,0,0,0,0,0
3,任何事物会红起来其背后都有着深远的意义！有需求才有存在的价值。凤姐存在的价值不就是让网友们吐槽的吗？网友们不是也吐的挺开心挺自豪挺满足的吗？最后供需双方都各自得到了想要的东西。网友通过吐槽得到了解压和发泄，凤姐通过被狂吐而声名远播。可谓是‘双赢’啊！但哪一方赢得更实在？有待考量！你们这群未来渺茫的人有什么资格嘲笑在500强工作的凤姐…（一老师如是说，看后我内牛满面！）,121,10,5,0,4,0,1,0,4,6
0,因为她！哈！我不说妳 也知！今天祖儿上凤凰卫视娱乐大风暴的视频。给偶像，还有祖儿的好朋友美女主持！,34,4,0,0,0,0,0,0,3,1
1,太棒了！射手要送我的礼物,8,0,0,0,0,0,0,0,0,0
0,回复哈哈。老实讲，对那个阶段完全停留在“他们说”的阶段。时代是波浪型上升的，说不定过几年还会有。。赚钱先，玩先，然后累了，有空会找找你说的那人。。哈哈。俺上了大学红高粱、穆斯林的葬礼…,65,5,0,0,0,0,0,0,2,3
0,哇塞！各种期待！由华谊当红小生主演的悬疑爆笑电影《熊出没注意》预定于10月1日上映。,26,2,0,0,0,0,0,0,2,0
0,回复还是彩色的瓜子，粉红色的香芋 瓜子，奶黄色的香蕉瓜子，看起来很有食欲呵呵好好玩哦。。我喜欢恰恰瓜子瓜子下稀饭。哈哈，因为吃着吃着稀饭饭突然想吃瓜子了。,51,7,1,0,1,0,0,0,4,3
2,网恋有风险，见面须谨慎。,8,1,0,0,0,0,0,0,1,0
0,之前上ART 親 手做的禮 物~,12,0,0,0,0,0,0,0,0,0
1,真的是个沉重的话题我们这代人真不容易父辈的其实更不容易我要攒钱买车买房。。。,22,2,0,0,0,0,0,0,2,0
2,"回复上班中。不在现场也知道你很抢镜的啦。你不会在我们的观众席吧？！哈哈…《幸福广州仁爱妈妈大赛总决赛》马上就要开始啦，四位主持木子，天华，COCO ,！加油！！",52,3,0,0,0,0,0,0,1,2
2,每次看到他们的故事都忍不住泪流世上还是有点爱情的爱情故事他遇见她时，他36，她23，他陡生爱怜。她结婚时，他赶来并送给她一枚蝴蝶胸针，其实他的丈夫是他介绍的。63岁的她走了，他来看她最后一眼。她生前衣物慈善义卖活动87岁的他拄着拐杖，去买回了那枚胸针。他们第一次合作的电影叫《罗马假日》，她就是“公主”郝本，他是“世界绅士”派克。@ 常识围脖,115,6,1,0,0,0,1,0,6,0
0,请原谅我今晚去打扰你们两位谈情了。。。因为我实在系太寂寞了。。我实在顶5顺寂寞我先去找你们。。。雯雯姐夫有无觉得你地生活有我而变得更精彩啊？？？今晚笑死你地两个,57,3,3,0,1,0,2,0,3,0
3,"拜谢！内牛满面！对付挖土仔两招：1，种植八方喷射的忧郁菇用咖啡豆唤醒，外面加个南瓜壳保护。2，用两头喷的那个豌豆也行，必须也用南瓜围住。这些都是在挖土僵尸啃南瓜的时间里就可以将其击毙的宝贝。植物大战僵尸正式通关，不过quickplay 里面，survival 那栏目最后一关“endless "" ，始终过不去，苦恼中。挖地道那组流氓僵尸实在搞不定，奶奶个腿的汗流浃背中……",108,3,7,0,5,1,2,0,3,0
0,回复嗯啊，问同样的问题，但要有不同的思路尤其是女客户回房，是个挺费脑子的事客户回房是个重复又费脑子的工作，大家有没有一些小敲门？,43,0,0,0,0,0,0,0,0,0
1,我靠！不带这么玩的，大风居然刮来一只臭鞋垫？对面在摆灵堂，这雷电交加风雨哗哗的。要是再一停电。。。我一人在家咋办啊咋办啊,40,0,0,0,0,0,0,0,0,0
0,回复我今天又回到榜首了，只是同城会排名上对我进行了处理，让我粉丝数及排名都在榜眼位置。微博这玩意儿其实蛮机灵的有人要河蟹你，你要争口气，重登合肥微博榜首。偶看好你。手上事多，腾不出手来围脖，那些曾经倍受我勤奋围脖骚扰的围友们近来一定觉得清净了不少吧。哈哈哈！哈哈哈！哈哈哈哈！哈哈哈！,87,7,1,0,0,0,1,0,7,0
0,倘若将毛泽东视作列宁与斯大林的混合体，邓小平时代是个延长的赫鲁晓夫年代，此刻的中国是否像是另一个“停滞年代”，那个勃列日涅夫的年代？,37,0,1,0,1,0,0,0,0,0
2,家属情绪确实挺稳定，一直处于崩溃状态这张图片我真的哭了矿工兄弟们清明快乐？家属情绪稳定？,25,4,2,0,2,0,0,0,2,2
2,明天不要下雨出点太阳好麽 唔该~,11,0,0,0,0,0,0,0,0,0
3,人家承认了，我国政府是不是打算一如既往的高姿态顺坡下驴了呢？？？我拭目以待！菲警方首度承认开枪射杀香港游客。,29,1,1,0,1,0,0,0,1,0
3,成績 出來 了啊~ ~ 偏科超嚴 重的,15,0,0,0,0,0,0,0,0,0
0,自作聪明的人，不在少数，尤其现在社会中。自作聪明，反被聪明误；自以为是，必自作自受。不以为然，但相同的故事一直重复着。如果你的命足够长的话，就不难发现这是真理。这太有意思了哈哈，这个很有意思。。。过河,59,3,5,0,5,0,0,0,2,1
1,这地图是不错~ 一定要转！小鬼子给我滚蛋！希望各位爱国人士此信息！大家团结一心，誓要将小日本赶出钓鱼岛！百度地图推出标记功能钓鱼岛惊现百度地图,41,3,1,0,1,0,0,0,3,0
0,干脆所有人都别来了，中国说了算就是了。韩国不参加六方会谈没关系，我们派人代表韩国参加就是了，,26,1,0,0,0,0,0,0,1,1
1,暖暖的。。。我们顶着鼻子睡，就不做恶梦啦，睡吧，晚安。。。,23,0,0,0,0,0,0,0,0,0
3,"无语...狗是人类忠实的朋友，有的时候甚至比朋友更靠谱理查森，男，纽约。从1984年起连续五次投资失败。2007后彻底破产，妻离子散，朋友消遁，唯有一条名叫“JOOY ”的狗与其不离不弃，忠伴左右,陪理查森一同在纽约的风雨街头乞讨。从“JOOY ”安详恬静的睡姿中看得出它对主人的无限信任和依靠。有的人，在沧海变成桑田时，表现得还不如一条狗。",106,9,5,0,3,0,2,0,7,2
1,一早上电脑当机3次咧,7,0,0,0,0,0,0,0,0,0
